{
  "run_id": "run-2026-07-29",
  "generated_at": "2026-07-28T21:52:08Z",
  "disclosure": {
    "en": "Replay of editorial run run-2026-07-29. Every step, model, verdict and block below is the recorded run; on-screen pacing is compressed and not to scale.",
    "id": "Pemutaran ulang proses editorial run-2026-07-29. Setiap langkah, model, putusan dan blokir di bawah ini adalah rekaman proses aslinya; tempo di layar dipadatkan dan tidak berskala."
  },
  "models": [
    "claude-fable-5",
    "claude-opus-5[1m]"
  ],
  "narratives_total": 10,
  "narratives_blocked": 5,
  "blocks_total": 7,
  "narratives": [
    {
      "narrative_id": "mbg-stop",
      "blocked_rounds": 1,
      "events": [
        {
          "kind": "slot",
          "role": "A5",
          "label": {
            "en": "Causal Extractor · mapping the asserted spine",
            "id": "Causal Extractor · memetakan rangka klaim"
          },
          "model": "claude-fable-5",
          "at": "2026-07-28T21:52:10Z"
        },
        {
          "kind": "slot",
          "role": "A6",
          "label": {
            "en": "Hidden-Node Hunter · hunting what the story prices at zero",
            "id": "Hidden-Node Hunter · memburu yang dihargai nol oleh berita"
          },
          "model": "claude-fable-5",
          "at": "2026-07-28T22:56:01Z"
        },
        {
          "kind": "slot",
          "role": "A7",
          "label": {
            "en": "Evidence Grounder · attaching sources, refusing orphan numbers",
            "id": "Evidence Grounder · menambatkan sumber, menolak angka tanpa sumber"
          },
          "model": "claude-opus-5[1m]",
          "at": "2026-07-28T22:56:26Z"
        },
        {
          "kind": "slot",
          "role": "A8",
          "label": {
            "en": "Cascade Historian · searching the case library for echoes",
            "id": "Cascade Historian · mencari gema di pustaka kasus"
          },
          "model": "claude-opus-5[1m]",
          "at": "2026-07-28T22:56:02Z"
        },
        {
          "kind": "slot",
          "role": "A9",
          "label": {
            "en": "Narrator · writing both languages from the locked graph",
            "id": "Narrator · menulis dua bahasa dari graf terkunci"
          },
          "model": "claude-opus-5[1m]",
          "at": "2026-07-28T23:28:07Z"
        },
        {
          "kind": "slot",
          "role": "A10",
          "label": {
            "en": "Symmetry Auditor · dissecting the mirror framing",
            "id": "Symmetry Auditor · membedah bingkai cermin"
          },
          "model": "claude-fable-5",
          "at": "2026-07-28T23:26:35Z"
        },
        {
          "kind": "slot",
          "role": "A11",
          "label": {
            "en": "Fidelity Guard · tracing every sentence to the graph",
            "id": "Fidelity Guard · menelusuri tiap kalimat ke graf"
          },
          "model": "claude-opus-5[1m]",
          "at": "2026-07-28T23:26:35Z"
        },
        {
          "kind": "block",
          "role": "A11",
          "gate": "fidelity",
          "judged_by": "claude-opus-5[1m]",
          "reason": "en / v-2: binding that does not resolve."
        },
        {
          "kind": "verdict",
          "role": "A10",
          "gate": "symmetry",
          "verdict": "pass",
          "model": "claude-fable-5",
          "summary": "Integrity: the attested sha256 df7b90d4… is candidate.json; the candidate embedded in A10.input.json is byte-identical to it."
        },
        {
          "kind": "verdict",
          "role": "A11",
          "gate": "fidelity",
          "verdict": "pass",
          "model": "claude-opus-5[1m]",
          "summary": "Pass one, bindings: 41 el_ids declared across 6 panels (claim_map spine n1-n4, edges e1-e4, hidden h1-h6; scale_check segments and chips; money_flow rows; incidence lanes; options and playbook steps; family marker mbg..."
        },
        {
          "kind": "published",
          "token": "f2468186c3b5"
        }
      ]
    },
    {
      "narrative_id": "mbg-cut",
      "blocked_rounds": 0,
      "events": [
        {
          "kind": "slot",
          "role": "A5",
          "label": {
            "en": "Causal Extractor · mapping the asserted spine",
            "id": "Causal Extractor · memetakan rangka klaim"
          },
          "model": "claude-fable-5",
          "at": "2026-07-28T22:58:10Z"
        },
        {
          "kind": "slot",
          "role": "A6",
          "label": {
            "en": "Hidden-Node Hunter · hunting what the story prices at zero",
            "id": "Hidden-Node Hunter · memburu yang dihargai nol oleh berita"
          },
          "model": "claude-fable-5",
          "at": "2026-07-29T00:22:19Z"
        },
        {
          "kind": "slot",
          "role": "A7",
          "label": {
            "en": "Evidence Grounder · attaching sources, refusing orphan numbers",
            "id": "Evidence Grounder · menambatkan sumber, menolak angka tanpa sumber"
          },
          "model": "claude-opus-5[1m]",
          "at": "2026-07-29T00:22:19Z"
        },
        {
          "kind": "slot",
          "role": "A8",
          "label": {
            "en": "Cascade Historian · searching the case library for echoes",
            "id": "Cascade Historian · mencari gema di pustaka kasus"
          },
          "model": "claude-opus-5[1m]",
          "at": "2026-07-29T00:22:19Z"
        },
        {
          "kind": "slot",
          "role": "A9",
          "label": {
            "en": "Narrator · writing both languages from the locked graph",
            "id": "Narrator · menulis dua bahasa dari graf terkunci"
          },
          "model": "claude-opus-5[1m]",
          "at": "2026-07-29T00:26:56Z"
        },
        {
          "kind": "slot",
          "role": "A10",
          "label": {
            "en": "Symmetry Auditor · dissecting the mirror framing",
            "id": "Symmetry Auditor · membedah bingkai cermin"
          },
          "model": "claude-fable-5",
          "at": "2026-07-29T00:27:00Z"
        },
        {
          "kind": "slot",
          "role": "A11",
          "label": {
            "en": "Fidelity Guard · tracing every sentence to the graph",
            "id": "Fidelity Guard · menelusuri tiap kalimat ke graf"
          },
          "model": "claude-opus-5[1m]",
          "at": "2026-07-29T00:27:01Z"
        },
        {
          "kind": "verdict",
          "role": "A10",
          "gate": "symmetry",
          "verdict": "pass",
          "model": "claude-fable-5",
          "summary": "Hash verified: embedded candidate re-serializes to sha256 8e7ca98bcda0920e98086d5a764a713a56870631bdf220e3a87668044f0c6488, byte-identical to slots/mbg-cut/candidate.json."
        },
        {
          "kind": "verdict",
          "role": "A11",
          "gate": "fidelity",
          "verdict": "pass",
          "model": "claude-opus-5[1m]",
          "summary": "Candidate integrity verified: candidate.json hashes to 8e7ca98bcda0920e98086d5a764a713a56870631bdf220e3a87668044f0c6488 as stated, and the candidate embedded in A11.input.json is deep-equal to those bytes (identical c..."
        },
        {
          "kind": "published",
          "token": "3fdc8c32d2bf"
        }
      ]
    },
    {
      "narrative_id": "mbg-poisoning",
      "blocked_rounds": 1,
      "events": [
        {
          "kind": "slot",
          "role": "A5",
          "label": {
            "en": "Causal Extractor · mapping the asserted spine",
            "id": "Causal Extractor · memetakan rangka klaim"
          },
          "model": "claude-fable-5",
          "at": "2026-07-28T22:58:10Z"
        },
        {
          "kind": "slot",
          "role": "A6",
          "label": {
            "en": "Hidden-Node Hunter · hunting what the story prices at zero",
            "id": "Hidden-Node Hunter · memburu yang dihargai nol oleh berita"
          },
          "model": "claude-fable-5",
          "at": "2026-07-29T00:22:06Z"
        },
        {
          "kind": "slot",
          "role": "A7",
          "label": {
            "en": "Evidence Grounder · attaching sources, refusing orphan numbers",
            "id": "Evidence Grounder · menambatkan sumber, menolak angka tanpa sumber"
          },
          "model": "claude-opus-5[1m]",
          "at": "2026-07-29T00:22:06Z"
        },
        {
          "kind": "slot",
          "role": "A8",
          "label": {
            "en": "Cascade Historian · searching the case library for echoes",
            "id": "Cascade Historian · mencari gema di pustaka kasus"
          },
          "model": "claude-opus-5[1m]",
          "at": "2026-07-29T00:22:06Z"
        },
        {
          "kind": "slot",
          "role": "A9",
          "label": {
            "en": "Narrator · writing both languages from the locked graph",
            "id": "Narrator · menulis dua bahasa dari graf terkunci"
          },
          "model": "claude-opus-5[1m]",
          "at": "2026-07-29T00:22:07Z"
        },
        {
          "kind": "slot",
          "role": "A10",
          "label": {
            "en": "Symmetry Auditor · dissecting the mirror framing",
            "id": "Symmetry Auditor · membedah bingkai cermin"
          },
          "model": "claude-fable-5",
          "at": "2026-07-29T00:41:57Z"
        },
        {
          "kind": "slot",
          "role": "A11",
          "label": {
            "en": "Fidelity Guard · tracing every sentence to the graph",
            "id": "Fidelity Guard · menelusuri tiap kalimat ke graf"
          },
          "model": "claude-opus-5[1m]",
          "at": "2026-07-29T00:41:57Z"
        },
        {
          "kind": "block",
          "role": "A11",
          "gate": "fidelity",
          "judged_by": "claude-opus-5[1m]",
          "reason": "locale en, sentence v-6: a claim that traces to no element."
        },
        {